{
  "contract": "lekishi-historical-contract/v0",
  "document": "publication_set",
  "set_id": "lks:set:qin-conquest-han-233-226-v1",
  "title": "Qin conquest of Han 233–226 BCE comparison fixture, preparation",
  "change_explanation": "Publishes the comparison fixture's preparation as one set: 4 places, 6 actors, 5 events, 4 relationships, and 1 story, with the 4 cited sources pinned. The set publishes the corrected revisions the internal review prepared and the label positions the owner's 2026-09-25 report led to: the submission's display placement at the Han capital the hereditary house records, and label anchors for the death at 雲陽 and the annexation at the 潁川 commandery, each resting on the cited historical geography's identification and placed at the modern place that carries the name. 南陽 stays without a position because the entries state no extent or seat and the name covers two regions in that historical geography. No place carries an asserted coordinate. The set records the preparing editor's self-review only: no owner decision exists for this content, it is comparison-only rather than a launch chapter, and RFD 4's AC2 does not apply to it.",
  "members": [
    {
      "record_id": "lks:actor:han-fei",
      "revision_id": "lks:rev:han-fei-2",
      "revision_hash": "sha256:235d77b80da506a039066bb4b9840c633c895a387e1b5af361589cddf6fcfff2"
    },
    {
      "record_id": "lks:actor:han-king-an",
      "revision_id": "lks:rev:han-king-an-2",
      "revision_hash": "sha256:ab3eef70d0f4ccc57b74ee1a860d514ac5336c190be7baad9fe71bff58c77f61"
    },
    {
      "record_id": "lks:actor:han-state",
      "revision_id": "lks:rev:han-state-1",
      "revision_hash": "sha256:784d95e61a29472e4b976cd70a7e305d1f1da3d2bbbe852c7362eab6d19b4ba8"
    },
    {
      "record_id": "lks:actor:nei-shi-teng",
      "revision_id": "lks:rev:nei-shi-teng-2",
      "revision_hash": "sha256:69c87dc8714a231085ecbcaf9f67c982eda9e2724ee6fcb0c4ccbf63ce0a3c9a"
    },
    {
      "record_id": "lks:actor:qin-king-zheng",
      "revision_id": "lks:rev:qin-king-zheng-2",
      "revision_hash": "sha256:84c87515b6efee89644110c0eea4bf790a94c6af669db20c4ff15ffb00597464"
    },
    {
      "record_id": "lks:actor:qin-state",
      "revision_id": "lks:rev:qin-state-1",
      "revision_hash": "sha256:9bb3a9235aea033121712f82de90e22f7c42d3ee0b580b7fd8ce879e2f5f3edf"
    },
    {
      "record_id": "lks:event:han-conquest-230",
      "revision_id": "lks:rev:han-conquest-230-3",
      "revision_hash": "sha256:cd78e7ddf387ff1742214289160981980bd78d84a6fd1d572c9b4356945c854e"
    },
    {
      "record_id": "lks:event:han-nanyang-cession-231",
      "revision_id": "lks:rev:han-nanyang-cession-231-3",
      "revision_hash": "sha256:06ea5049d2bd706fb7f9660057424f8ec5d662e6351d1a71aa01f7abf7eea130"
    },
    {
      "record_id": "lks:event:han-submission-233",
      "revision_id": "lks:rev:han-submission-233-3",
      "revision_hash": "sha256:e6cf86ca6e8c47df082e65c4d1f42a1c6c9290b04a99e1dd00d513f250777675"
    },
    {
      "record_id": "lks:event:hanfei-death-233",
      "revision_id": "lks:rev:hanfei-death-233-2",
      "revision_hash": "sha256:f4cdc69cce688d5511cda605816b30e9ad866431ac481f340bdcfea550f9db92"
    },
    {
      "record_id": "lks:event:xinzheng-revolt-226",
      "revision_id": "lks:rev:xinzheng-revolt-226-1",
      "revision_hash": "sha256:416fc0a5b29d48148760da770d3a07188cfa4b85fe14e5642766c9e01610cffd"
    },
    {
      "record_id": "lks:place:nanyang",
      "revision_id": "lks:rev:nanyang-3",
      "revision_hash": "sha256:300f5256859469e18df45851cae1050ca0ff60aa6bc3f866d05f1b9552ac1bc2"
    },
    {
      "record_id": "lks:place:xinzheng",
      "revision_id": "lks:rev:xinzheng-2",
      "revision_hash": "sha256:140bdd0d74bd90c41cffbccaf21321aaf7bd53110c64c827be8c535b769ab415"
    },
    {
      "record_id": "lks:place:yingchuan",
      "revision_id": "lks:rev:yingchuan-2",
      "revision_hash": "sha256:b5c326d2f633958edadf17d53e507b971099ad69ad42068be37b8f67727a9de3"
    },
    {
      "record_id": "lks:place:yunyang",
      "revision_id": "lks:rev:yunyang-2",
      "revision_hash": "sha256:2d4c5a7112d7c4bfeeaf38789b2d3f75ec9c22e7842b7c3a0c10e4017d87c4b1"
    },
    {
      "record_id": "lks:relationship:han-annexation-yingchuan",
      "revision_id": "lks:rev:han-annexation-yingchuan-1",
      "revision_hash": "sha256:277d62397355ccafd9ff30810d9fcc58ae38ddb0d13a1075d0772539237aedd1"
    },
    {
      "record_id": "lks:relationship:han-nanyang-cession",
      "revision_id": "lks:rev:han-nanyang-cession-2",
      "revision_hash": "sha256:0ba9693ba4099e46ca02cba48a3ced2887c930d031188f70904bf254fb290f2e"
    },
    {
      "record_id": "lks:relationship:han-qin-submission",
      "revision_id": "lks:rev:han-qin-submission-1",
      "revision_hash": "sha256:1e29aa6dc9980786b512826e5cf9c419caaf0c9b333213cf5fb4730d0ea2f472"
    },
    {
      "record_id": "lks:relationship:qin-han-conflict",
      "revision_id": "lks:rev:qin-han-conflict-2",
      "revision_hash": "sha256:31a1d037071c281d5a84373e823b3f6dc88b0a34993b58c8059e8cbfaaca7c06"
    },
    {
      "record_id": "lks:story:qin-conquest-han-233-226",
      "revision_id": "lks:rev:qin-conquest-han-story-3",
      "revision_hash": "sha256:04a3fb3afca83a1d29af37c8081930586ce3bb3fbf9fd54cae9780515099ab70"
    }
  ],
  "sources": [
    {
      "source_id": "lks:source:dushi-fangyu-jiyao",
      "source_hash": "sha256:9f757097956e0f4ce346b051855daca6e0668fd2515175aad01e214d6ba1c350"
    },
    {
      "source_id": "lks:source:shiji",
      "source_hash": "sha256:8aacfcd9f0172a1da2aff4041e942597e6438c8acad0020dccf917acb7f94c18"
    },
    {
      "source_id": "lks:source:wikidata",
      "source_hash": "sha256:0709a438d7b939cca7eae38047e62b136ca1c0ab9cb38900db1e8e29338e2705"
    },
    {
      "source_id": "lks:source:zizhi-tongjian",
      "source_hash": "sha256:1423d95b9b93f87b06169f660fae152c348e96587d7ba37cde09fc6fd834bb7d"
    }
  ],
  "review": {
    "reviewed_at": "2026-09-25T20:25:00Z",
    "reviewer": {
      "name": "Lekishi editorial preparation",
      "role": "preparing editor (self-review)"
    },
    "independence": "self_review",
    "checklist": {
      "source_support": true,
      "attribution": true,
      "date_location_uncertainty": true,
      "attestation_vs_interpretation": true,
      "reuse_rights": true
    },
    "notes": "Self-review of the comparison fixture, recorded explicitly and re-recorded after the internal review's corrections, the submission event's display placement, and the label anchors added for the owner's 2026-09-25 report that locations were missing where the records name them. The anchors rest on the cited historical geography's identifications and on Wikidata coordinates for modern places; no historical coordinate is asserted anywhere, and 南陽 keeps unknown geometry with the two regions the name covers recorded. This is not owner review, not independent review, and not specialist review: the owner instructed the bounded Qin comparison fixture and asked to review the corrected content before deciding, so no owner decision exists for this content. It is a preparation snapshot; the fixture is comparison-only, it is not a launch chapter, and RFD 4's AC2 does not apply to it."
  },
  "published_at": "2026-09-25T20:30:00Z",
  "published_by": {
    "name": "Lekishi editorial preparation",
    "role": "preparing editor (owner-instructed)"
  },
  "supersedes": null,
  "correction_of_revision": null
}
