{
  "contract": "lekishi-historical-contract/v0",
  "document": "publication_set",
  "set_id": "lks:set:tang-mission-750-754-court-anchors",
  "title": "Tang mission 750–754 chapter, court-act placements and place identifications",
  "change_explanation": "Publishes the owner-accepted placement of the chapter's court acts: one new place record for the court's seat (平城宮, the palace of 平城京) and corrected revisions of the ten events whose entries name no place (or name 内裏). It also publishes the two place identifications the owner asked to chase: 紀伊國牟漏埼, which the cited prefectural record reports 紀伊続風土記 identified with 太地の燈明崎, and 薩摩國石籬浦, which the cited prefectural record names as 石垣 in present-day 南九州市穎娃町. Both are approximate locality-level placements labelled as modern proposals, not source statements; 驩州 stays unplaced because no source in the set identifies its site. Each act is anchored at the palace as a display anchor; no coordinate is asserted, and the palace's attestation and the modern site's coordinate are cited on the place record. The owner accepted this recommendation on 2026-09-24; it is a decision to publish this content, not the owner's editorial approval under RFD 2, and the specialist reviews remain outstanding. The revisions and pins published by lks:set:tang-mission-750-754-v1 and lks:set:tang-mission-750-754-v2 stay in the tree unchanged.",
  "members": [
    {
      "record_id": "lks:place:heijo-palace",
      "revision_id": "lks:rev:heijo-palace-1",
      "revision_hash": "sha256:117d516227d1cc35cca80651c5d5604aa3fdb0fbaeed2b730a245cfb27700dda"
    },
    {
      "record_id": "lks:event:appointment-750",
      "revision_id": "lks:rev:appointment-750-2",
      "revision_hash": "sha256:6a47f0901932bf40f4abdc51f3ca4a951d622b3677436264215b82a5bacba31b"
    },
    {
      "record_id": "lks:event:kibi-appointment-751",
      "revision_id": "lks:rev:kibi-appointment-751-2",
      "revision_hash": "sha256:497f7ddeb1f77190cc1c20152607511ed336c610ae96c148bacef771fb4db825"
    },
    {
      "record_id": "lks:event:court-audience-752",
      "revision_id": "lks:rev:court-audience-752-2",
      "revision_hash": "sha256:b6901e6156019b6f48277541c623b16ca9b1c0e60f89f46f29e3742234e36540"
    },
    {
      "record_id": "lks:event:sekito-752",
      "revision_id": "lks:rev:sekito-752-2",
      "revision_hash": "sha256:d3af6cf3770187ce13f6057b5ff3b3c13fb63693f522045d72a6089910d27f03"
    },
    {
      "record_id": "lks:event:audience-report-754",
      "revision_id": "lks:rev:audience-report-754-2",
      "revision_hash": "sha256:2fe8aa9fadefa8ac201050d8dbe554331693bea8dcd614cf42d8d3e43cc92f1c"
    },
    {
      "record_id": "lks:event:return-report-754",
      "revision_id": "lks:rev:return-report-754-3",
      "revision_hash": "sha256:73fed0b7d3aaf66b615adf218a2778ed51f9f1d5fafff5b3543eca6c8ca045e0"
    },
    {
      "record_id": "lks:event:rewards-754",
      "revision_id": "lks:rev:rewards-754-2",
      "revision_hash": "sha256:7d922ac46ab4d9f79844318b457fbd051cbe9424cb020134a86cd84fb57e7a37"
    },
    {
      "record_id": "lks:event:daikasho-title-758",
      "revision_id": "lks:rev:daikasho-title-758-2",
      "revision_hash": "sha256:d9e7c5e73477c5dad76d5caa4d5410b573e2e2ea8f43f94748da70d2a13b6355"
    },
    {
      "record_id": "lks:event:kiyokawa-honours-779",
      "revision_id": "lks:rev:kiyokawa-honours-779-2",
      "revision_hash": "sha256:92479348889597ee1b99d6f5939ff68f74980b94aed606c17a0c28e2d457ec1b"
    },
    {
      "record_id": "lks:event:nakamaro-death-779",
      "revision_id": "lks:rev:nakamaro-death-779-2",
      "revision_hash": "sha256:86e9e6abe89d4e2c143efa33eb6e6fd77327e4c62fd244576411afd8b402e1f7"
    },
    {
      "record_id": "lks:place:murozaki",
      "revision_id": "lks:rev:murozaki-2",
      "revision_hash": "sha256:e37605aadde11af06252742a05a3d142f9644e311f28278c54954e39ca1c6b24"
    },
    {
      "record_id": "lks:place:ishigaki",
      "revision_id": "lks:rev:ishigaki-2",
      "revision_hash": "sha256:8f2a48bf6438e61bd9b70515e6f145db67f0e767213dfa18984398be86910837"
    }
  ],
  "sources": [
    {
      "source_id": "lks:source:shoku-nihongi",
      "source_hash": "sha256:e263132f5953555ac8cfefaed3a20047dbe2675a3cb043e72b96ab8be1b7f89d"
    },
    {
      "source_id": "lks:source:toseiden",
      "source_hash": "sha256:f21eecdcc1405410e364d34ac509180e4ce6e51541535fe734e70b34e213a5dc"
    },
    {
      "source_id": "lks:source:jiu-tangshu",
      "source_hash": "sha256:b02e0b9bb6bbf60dfbcdcc8fbf130e2dee0818d51a0c8281119a898ab8108196"
    },
    {
      "source_id": "lks:source:xin-tangshu",
      "source_hash": "sha256:8a900104e3397bfc7098d8610f812c2d76ee8e892133bf761cfae4d958b110bc"
    },
    {
      "source_id": "lks:source:chimei-taikei-ata",
      "source_hash": "sha256:bc6f40711fc771c6bd69865a3414f2e8b07b9ac41ca7a768d84a27faa9719484"
    },
    {
      "source_id": "lks:source:okinawa-daihyakka-ajinawa",
      "source_hash": "sha256:9a1a4778786333f5d2af7cd6592c96a3886525810dd86a4b7d8c08642851e70f"
    },
    {
      "source_id": "lks:source:yamakawa-nihonshi-tane",
      "source_hash": "sha256:cebeab68f061b6a5168e208fbc4210cba3164cbf9ad244fd61278616dbd65960"
    },
    {
      "source_id": "lks:source:ryukyu-university-tokara",
      "source_hash": "sha256:8fde307becb3df9b777351b9bece7bd9da8076c966e6c6e8b90b45da76adbb0b"
    },
    {
      "source_id": "lks:source:wikidata",
      "source_hash": "sha256:f809e6af1b93dc1610af78d2e96d927d490335cc6089f36702e6f2b1c913761a"
    },
    {
      "source_id": "lks:source:wakayama-kibi-drift",
      "source_hash": "sha256:0f27cecc0b25f3c4d843e529c01a7de02f33da21c854af381b226e99220ddee2"
    },
    {
      "source_id": "lks:source:kagoshima-folk-ishigaki",
      "source_hash": "sha256:be054790a6e38cd5a4a15477b9424009a84d3c8ab4f36450b4a0dc75efe78ff4"
    }
  ],
  "review": {
    "reviewed_at": "2026-09-24T22:45:00Z",
    "reviewer": {
      "name": "Lekishi editorial preparation",
      "role": "preparing editor (self-review)"
    },
    "independence": "self_review",
    "checklist": {
      "source_support": true,
      "attribution": true,
      "date_location_uncertainty": true,
      "attestation_vs_interpretation": true,
      "reuse_rights": true
    },
    "notes": "Self-review of the placement corrections, recorded explicitly. The palace's naming and the inner-precinct form were re-checked against the cited transcription on 2026-09-24. This is not owner review, not independent review, and not specialist review: the owner decided that this content may be published, but the owner's editorial approval under RFD 2 is still pending, so RFD 4 AC2 is not satisfied by this set, and the specialist reviews the feasibility report identifies have not been performed."
  },
  "published_at": "2026-09-24T23:00:00Z",
  "published_by": {
    "name": "Lekishi editorial preparation",
    "role": "preparing editor (owner-instructed)"
  },
  "supersedes": "lks:set:tang-mission-750-754-v2",
  "correction_of_revision": null
}
